<!ELEMENT autos (auto+)>
<!ELEMENT auto (marca, modelo, anio, color, precio)>
<!ELEMENT marca (#PCDATA)>
<!ELEMENT modelo (#PCDATA)>
<!ELEMENT anio (#PCDATA)>
<!ELEMENT color (#PCDATA)>
<!ELEMENT precio (#PCDATA)>