<?xml version="1.0" encoding="UTF-8"?>
<!DOCTYPE autos SYSTEM "Autos.dtd">

<autos>
    <auto>
        <marca>Toyota</marca>
        <modelo>Corolla</modelo>
        <anio>2022</anio>
        <color>Blanco</color>
        <precio>320000</precio>
        <noPuertas>4</noPuertas>
    </auto>

    <auto>
        <marca>Honda</marca>
        <modelo>Civic</modelo>
        <anio>2021</anio>
        <color>Negro</color>
        <precio>350000</precio>
        <noPuertas>4</noPuertas>
    </auto>

    <auto>
        <marca>Nissan</marca>
        <modelo>Sentra</modelo>
        <anio>2023</anio>
        <color>Gris</color>
        <precio>380000</precio>
        <noPuertas>4</noPuertas>
    </auto>

    <auto>
        <marca>Volkswagen</marca>
        <modelo>Jetta</modelo>
        <anio>2020</anio>
        <color>Rojo</color>
        <precio>290000</precio>
        <noPuertas>4</noPuertas>
    </auto>

    <auto>
        <marca>Chevrolet</marca>
        <modelo>Aveo</modelo>
        <anio>2022</anio>
        <color>Azul</color>
        <precio>250000</precio>
        <noPuertas>4</noPuertas>
    </auto>

    <auto>
        <marca>Kia</marca>
        <modelo>Rio</modelo>
        <anio>2021</anio>
        <color>Plata</color>
        <precio>270000</precio>
        <noPuertas>4</noPuertas>
    </auto>

    <auto>
        <marca>Hyundai</marca>
        <modelo>Elantra</modelo>
        <anio>2023</anio>
        <color>Blanco</color>
        <precio>390000</precio>
        <noPuertas>4</noPuertas>
    </auto>

    <auto>
        <marca>Mazda</marca>
        <modelo>Mazda 3</modelo>
        <anio>2022</anio>
        <color>Rojo</color>
        <precio>420000</precio>
        <noPuertas>4</noPuertas>
    </auto>

    <auto>
        <marca>Ford</marca>
        <modelo>Mustang</modelo>
        <anio>2020</anio>
        <color>Amarillo</color>
        <precio>780000</precio>
        <noPuertas>2</noPuertas>
    </auto>

    <auto>
        <marca>Chevrolet</marca>
        <modelo>Camaro</modelo>
        <anio>2021</anio>
        <color>Negro</color>
        <precio>850000</precio>
        <noPuertas>2</noPuertas>
    </auto>

    <auto>
        <marca>BMW</marca>
        <modelo>Serie 3</modelo>
        <anio>2022</anio>
        <color>Azul</color>
        <precio>950000</precio>
        <noPuertas>4</noPuertas>
    </auto>

    <auto>
        <marca>Mercedes-Benz</marca>
        <modelo>Clase C</modelo>
        <anio>2023</anio>
        <color>Gris</color>
        <precio>1100000</precio>
        <noPuertas>4</noPuertas>
    </auto>

    <auto>
        <marca>Audi</marca>
        <modelo>A4</modelo>
        <anio>2021</anio>
        <color>Blanco</color>
        <precio>880000</precio>
        <noPuertas>4</noPuertas>
    </auto>

    <auto>
        <marca>Tesla</marca>
        <modelo>Model 3</modelo>
        <anio>2023</anio>
        <color>Negro</color>
        <precio>920000</precio>
        <noPuertas>4</noPuertas>
    </auto>

    <auto>
        <marca>Renault</marca>
        <modelo>Kwid</modelo>
        <anio>2022</anio>
        <color>Naranja</color>
        <precio>230000</precio>
        <noPuertas>4</noPuertas>
    </auto>

    <auto>
        <marca>Seat</marca>
        <modelo>Ibiza</modelo>
        <anio>2021</anio>
        <color>Rojo</color>
        <precio>310000</precio>
        <noPuertas>4</noPuertas>
    </auto>

    <auto>
        <marca>Suzuki</marca>
        <modelo>Swift</modelo>
        <anio>2023</anio>
        <color>Azul</color>
        <precio>330000</precio>
        <noPuertas>4</noPuertas>
    </auto>

    <auto>
        <marca>Peugeot</marca>
        <modelo>208</modelo>
        <anio>2022</anio>
        <color>Gris</color>
        <precio>360000</precio>
        <noPuertas>4</noPuertas>
    </auto>

    <auto>
        <marca>Fiat</marca>
        <modelo>Argo</modelo>
        <anio>2020</anio>
        <color>Blanco</color>
        <precio>260000</precio>
        <noPuertas>4</noPuertas>
    </auto>

    <auto>
        <marca>Mitsubishi</marca>
        <modelo>Mirage</modelo>
        <anio>2021</anio>
        <color>Plata</color>
        <precio>240000</precio>
        <noPuertas>4</noPuertas>
    </auto>

    <auto>
        <marca>Jeep</marca>
        <modelo>Wrangler</modelo>
        <anio>2022</anio>
        <color>Verde</color>
        <precio>1150000</precio>
        <noPuertas>2</noPuertas>
    </auto>

    <auto>
        <marca>Honda</marca>
        <modelo>CR-V</modelo>
        <anio>2023</anio>
        <color>Negro</color>
        <precio>720000</precio>
        <noPuertas>4</noPuertas>
    </auto>

    <auto>
        <marca>Toyota</marca>
        <modelo>RAV4</modelo>
        <anio>2022</anio>
        <color>Gris</color>
        <precio>690000</precio>
        <noPuertas>4</noPuertas>
    </auto>

    <auto>
        <marca>Nissan</marca>
        <modelo>Kicks</modelo>
        <anio>2021</anio>
        <color>Rojo</color>
        <precio>410000</precio>
        <noPuertas>4</noPuertas>
    </auto>

    <auto>
        <marca>Ford</marca>
        <modelo>Explorer</modelo>
        <anio>2023</anio>
        <color>Azul</color>
        <precio>980000</precio>
        <noPuertas>4</noPuertas>
    </auto>
</autos>